{
  "goal": "Clean and analyze customer database",
  "capabilities": [
    "fs.read",
    "fs.write"
  ],
  "steps": [
    {
      "id": "step1",
      "op": "load_csv",
      "description": "Load raw customer data from CRM CSV",
      "in": "sandbox/in/crm_customers.csv",
      "out": "$raw_customer_data"
    },
    {
      "id": "step2",
      "op": "profile_schema",
      "description": "Generate metadata and analyze dataset schema",
      "in": "$raw_customer_data",
      "out": "$data_schema"
    },
    {
      "id": "step3",
      "op": "profile_schema",
      "description": "Deduplicate and reconcile customer records",
      "in": {
        "crm_data": "$raw_customer_data",
        "confidence_threshold": 0.75
      },
      "out": "$clean_customer_data"
    },
    {
      "id": "step4",
      "op": "profile_schema",
      "description": "Validate data consistency across enterprise systems",
      "in": {
        "primary_source": "$clean_customer_data",
        "reference_sources": [],
        "match_fields": [
          "email",
          "customer_id"
        ],
        "validation_rules": {}
      },
      "out": "$validated_customer_data"
    },
    {
      "id": "step5",
      "op": "emit_report",
      "description": "Generate actionable business recommendations",
      "in": {
        "customer_data": "$validated_customer_data",
        "focus_areas": [
          "revenue",
          "customer_retention"
        ]
      },
      "out": "$customer_insights"
    },
    {
      "id": "step6",
      "op": "emit_report",
      "description": "Create markdown report of findings",
      "in": {
        "schema": "$data_schema",
        "metrics": "$customer_insights"
      }
    }
  ],
  "inputs": {
    "main_input": "sandbox/in/crm_customers.csv"
  },
  "_generated_at": "2025-09-14T10:08:51Z"
}